{
  "version": "1.0.0",
  "source": {
    "sha256": "4157b2d31f2e585bab3d13ff7c0c4bb319860f22cf48af85ef83107903ad29ae",
    "filePath": "fixtures/fixture_d.mp4",
    "dimensions": {
      "width": 1920,
      "height": 1080
    },
    "durationSec": 2,
    "totalFrames": 60
  },
  "timebase": {
    "ticksPerSecond": 120000,
    "rationalFps": {
      "numerator": 30,
      "denominator": 1
    },
    "durationTicks": 240000
  },
  "shots": [
    {
      "shotId": "shot_01",
      "startFrame": 0,
      "endFrame": 59,
      "startPts": 0,
      "endPts": 1.9666666666666666,
      "cutConfidence": 1,
      "cutType": "initial"
    }
  ],
  "entities": [
    {
      "entityId": "ent_01",
      "label": "subject",
      "shotId": "shot_01",
      "policyAcrossCuts": "reset_on_cut"
    }
  ],
  "frames": [
    {
      "frameIndex": 0,
      "pts": 0,
      "tick": 0,
      "shotId": "shot_01",
      "cameraMotion": {
        "model": "affine",
        "translation": {
          "dx": 0,
          "dy": 0
        },
        "scale": 1,
        "rotation": 0,
        "confidence": 1,
        "valid": true
      },
      "observations": [
        {
          "entityId": "ent_01",
          "bbox": {
            "pixel": {
              "x": 300,
              "y": 650,
              "width": 120,
              "height": 160
            },
            "normalized": {
              "x": 0.15625,
              "y": 0.6018518518518519,
              "width": 0.0625,
              "height": 0.14814814814814814
            }
          },
          "center": {
            "pixel": [
              360,
              730
            ],
            "normalized": [
              0.1875,
              0.6759259259259259
            ]
          },
          "visibility": "visible",
          "visibilityConfidence": 1,
          "trackingConfidence": 1,
          "motion": {
            "raw": {
              "dx": 20.338983050847457,
              "dy": -10,
              "valid": false
            },
            "compensated": {
              "dx": 20.338983050847457,
              "dy": -10,
              "valid": false
            }
          }
        }
      ]
    },
    {
      "frameIndex": 1,
      "pts": 0.03333333333333333,
      "tick": 4000,
      "shotId": "shot_01",
      "cameraMotion": {
        "model": "affine",
        "translation": {
          "dx": 0,
          "dy": 0
        },
        "scale": 1,
        "rotation": 0.005084745762711864,
        "confidence": 1,
        "valid": true
      },
      "observations": [
        {
          "entityId": "ent_01",
          "bbox": {
            "pixel": {
              "x": 320.33898305084745,
              "y": 630.0057454754381,
              "width": 120,
              "height": 160
            },
            "normalized": {
              "x": 0.16684322033898305,
              "y": 0.5833386532179982,
              "width": 0.0625,
              "height": 0.14814814814814814
            }
          },
          "center": {
            "pixel": [
              380.33898305084745,
              710.0057454754381
            ],
            "normalized": [
              0.19809322033898305,
              0.6574127272920722
            ]
          },
          "visibility": "visible",
          "visibilityConfidence": 1,
          "trackingConfidence": 1,
          "motion": {
            "raw": {
              "dx": 20.338983050847457,
              "dy": -10,
              "valid": true
            },
            "compensated": {
              "dx": 20.338983050847457,
              "dy": -10,
              "valid": true
            }
          }
        }
      ]
    },
    {
      "frameIndex": 2,
      "pts": 0.06666666666666667,
      "tick": 8000,
      "shotId": "shot_01",
      "cameraMotion": {
        "model": "affine",
        "translation": {
          "dx": 0,
          "dy": 0
        },
        "scale": 1,
        "rotation": 0.005084745762711864,
        "confidence": 1,
        "valid": true
      },
      "observations": [
        {
          "entityId": "ent_01",
          "bbox": {
            "pixel": {
              "x": 340.6779661016949,
              "y": 610.7009480034473,
              "width": 120,
              "height": 160
            },
            "normalized": {
              "x": 0.1774364406779661,
              "y": 0.5654638407439326,
              "width": 0.0625,
              "height": 0.14814814814814814
            }
          },
          "center": {
            "pixel": [
              400.6779661016949,
              690.7009480034473
            ],
            "normalized": [
              0.2086864406779661,
              0.6395379148180067
            ]
          },
          "visibility": "visible",
          "visibilityConfidence": 1,
          "trackingConfidence": 1,
          "motion": {
            "raw": {
              "dx": 20.338983050847457,
              "dy": -10,
              "valid": true
            },
            "compensated": {
              "dx": 20.338983050847457,
              "dy": -10,
              "valid": true
            }
          }
        }
      ]
    },
    {
      "frameIndex": 3,
      "pts": 0.1,
      "tick": 12000,
      "shotId": "shot_01",
      "cameraMotion": {
        "model": "affine",
        "translation": {
          "dx": 0,
          "dy": 0
        },
        "scale": 1,
        "rotation": 0.005084745762711864,
        "confidence": 1,
        "valid": true
      },
      "observations": [
        {
          "entityId": "ent_01",
          "bbox": {
            "pixel": {
              "x": 361.0169491525424,
              "y": 592.0856075840276,
              "width": 120,
              "height": 160
            },
            "normalized": {
              "x": 0.18802966101694915,
              "y": 0.5482274144296552,
              "width": 0.0625,
              "height": 0.14814814814814814
            }
          },
          "center": {
            "pixel": [
              421.0169491525424,
              672.0856075840276
            ],
            "normalized": [
              0.21927966101694915,
              0.6223014885037292
            ]
          },
          "visibility": "visible",
          "visibilityConfidence": 1,
          "trackingConfidence": 1,
          "motion": {
            "raw": {
              "dx": 20.338983050847457,
              "dy": -10,
              "valid": true
            },
            "compensated": {
              "dx": 20.338983050847457,
              "dy": -10,
              "valid": true
            }
          }
        }
      ]
    },
    {
      "frameIndex": 4,
      "pts": 0.13333333333333333,
      "tick": 16000,
      "shotId": "shot_01",
      "cameraMotion": {
        "model": "affine",
        "translation": {
          "dx": 0,
          "dy": 0
        },
        "scale": 1,
        "rotation": 0.005084745762711864,
        "confidence": 1,
        "valid": true
      },
      "observations": [
        {
          "entityId": "ent_01",
          "bbox": {
            "pixel": {
              "x": 381.35593220338984,
              "y": 574.159724217179,
              "width": 120,
              "height": 160
            },
            "normalized": {
              "x": 0.1986228813559322,
              "y": 0.5316293742751658,
              "width": 0.0625,
              "height": 0.14814814814814814
            }
          },
          "center": {
            "pixel": [
              441.35593220338984,
              654.159724217179
            ],
            "normalized": [
              0.2298728813559322,
              0.6057034483492398
            ]
          },
          "visibility": "visible",
          "visibilityConfidence": 1,
          "trackingConfidence": 1,
          "motion": {
            "raw": {
              "dx": 20.338983050847457,
              "dy": -10,
              "valid": true
            },
            "compensated": {
              "dx": 20.338983050847457,
              "dy": -10,
              "valid": true
            }
          }
        }
      ]
    },
    {
      "frameIndex": 5,
      "pts": 0.16666666666666666,
      "tick": 20000,
      "shotId": "shot_01",
      "cameraMotion": {
        "model": "affine",
        "translation": {
          "dx": 0,
          "dy": 0
        },
        "scale": 1,
        "rotation": 0.005084745762711864,
        "confidence": 1,
        "valid": true
      },
      "observations": [
        {
          "entityId": "ent_01",
          "bbox": {
            "pixel": {
              "x": 401.6949152542373,
              "y": 556.9232979029015,
              "width": 120,
              "height": 160
            },
            "normalized": {
              "x": 0.20921610169491525,
              "y": 0.5156697202804643,
              "width": 0.0625,
              "height": 0.14814814814814814
            }
          },
          "center": {
            "pixel": [
              461.6949152542373,
              636.9232979029015
            ],
            "normalized": [
              0.24046610169491525,
              0.5897437943545384
            ]
          },
          "visibility": "visible",
          "visibilityConfidence": 1,
          "trackingConfidence": 1,
          "motion": {
            "raw": {
              "dx": 20.338983050847457,
              "dy": -10,
              "valid": true
            },
            "compensated": {
              "dx": 20.338983050847457,
              "dy": -10,
              "valid": true
            }
          }
        }
      ]
    },
    {
      "frameIndex": 6,
      "pts": 0.2,
      "tick": 24000,
      "shotId": "shot_01",
      "cameraMotion": {
        "model": "affine",
        "translation": {
          "dx": 0,
          "dy": 0
        },
        "scale": 1,
        "rotation": 0.005084745762711864,
        "confidence": 1,
        "valid": true
      },